{"$schema":"https://json-schema.org/draft/2020-12/schema","$id":"https://agentpass.dev/contracts/maintenance-usage-attestation-v1.schema.json","type":"object","additionalProperties":false,"required":["schema_version","kind","attestation_id","organization_id","app_id","provider_id","source_digest","observed_at","usages"],"properties":{"schema_version":{"const":1},"kind":{"const":"agentpass.maintenance.usage-attestation"},"attestation_id":{"type":"string"},"organization_id":{"type":"string"},"app_id":{"type":"string"},"provider_id":{"type":"string"},"source_digest":{"type":"string","pattern":"^[0-9a-f]{64}$"},"observed_at":{"type":"string","format":"date-time"},"usages":{"type":"array","minItems":0,"maxItems":1024,"items":{"type":"object","additionalProperties":false,"required":["selector","file","line"],"properties":{"selector":{"type":"string","minLength":1,"maxLength":512},"file":{"type":"string","pattern":"^/"},"line":{"type":"integer","minimum":1}}}}}}
